code,slug,label,prefix,suffix,subText,decimalPlaces,howToMeasureChange,subtitle,zeroBaseline,canBeNegative,experimentalStatistic,sourceDate,sourceURL,sourceOrg,longDescription,coverageLevel
public-funded-gross-regional-capital-and-non-capital-expenditure-on-research-and-development,public-funded-gross-regional-capital-and-non-capital-expenditure-on-research-and-development,Research and development expenditure,GBPSign,,million,0,abs,Public-funded gross expenditure within this region,F,F,T,17/04/2023,https://www.ons.gov.uk/economy/governmentpublicsectorandtaxes/researchanddevelopmentexpenditure/articles/ukpublicfundedgrossregionalcapitalandnoncapitalexpenditureonresearchanddevelopment/financialyearending2021/relateddata,Office for National Statistics,"This dataset shows the total UK public-funded gross regional capital and non-capital expenditure on research and development (official statistics in development), in the UK, for financial year 2020 - 2021.","Data for this indicator is available for local authorities from XXX to YYY, and for regions and countries from ZZZ to QQQ."
foreign-direct-investment-Inward foreign direct investment (FDI),inward-foreign-direct-investment-fdi-new,Inward foreign direct investment,GBPSign,,million,0,abs,Value of foreign direct investments (FDI) in the UK from non-resident companies,F,F,T,24/04/2023,https://www.ons.gov.uk/economy/nationalaccounts/balanceofpayments/articles/foreigndirectinvestmentexperimentaluksubnationalstatistics/previousReleases,Office for National Statistics,"This dataset shows the total FDI international investment position in the UK (inward) at end period (official statistics in development), in Great Britain (Northern Ireland national figure included), for 2015-2021.","Data for this indicator is available for local authorities from XXX to YYY, and for regions and countries from ZZZ to QQQ."
foreign-direct-investment-Outward foreign direct investment (FDI),outward-foreign-direct-investment-fdi,Outward foreign direct investment,GBPSign,,million,0,abs,Value of foreign direct investments (FDI) of UK-resident companies in other countries,F,F,T,24/04/2023,https://www.ons.gov.uk/economy/nationalaccounts/balanceofpayments/articles/foreigndirectinvestmentexperimentaluksubnationalstatistics/previousReleases,Office for National Statistics,"This dataset shows the total FDI international investment position abroad (outward) at end period (official statistics in development), in Great Britain (Northern Ireland national figure included), for 2015-2021.","Data for this indicator is available for local authorities from XXX to YYY, and for regions and countries from ZZZ to QQQ."
early-years-Communication and Language,early-years-communication-language,Communication and language skills by end of early years foundation stage,,%,,1,pp,Percentage of 5 year olds at 'expected level' across all communication and language early learning goals,F,F,F,30/11/2023,https://explore-education-statistics.service.gov.uk/find-statistics/early-years-foundation-stage-profile-results,Department for Education,"This dataset shows the early years foundation stage profile outcomes of five year olds. Percentage at 'expected level' across all communication and language early learning goals, in England (state-funded schools), for academic years 2021/22 to 2022/23.","Data for this indicator is available for local authorities from XXX to YYY, and for regions and countries from ZZZ to QQQ."
early-years-Literacy,early-years-literacy,Literacy skills by end of early years foundation stage,,%,,1,pp,Percentage of 5 year olds at 'expected level' across all literacy early learning goals,F,F,F,30/11/2023,https://explore-education-statistics.service.gov.uk/find-statistics/early-years-foundation-stage-profile-results,Department for Education,"This dataset shows the early years foundation stage profile outcomes of five year olds. Percentage at 'expected level' across all literacy early learning goals, in England (state-funded schools), for academic years 2021/22 to 2022/23.","Data for this indicator is available for local authorities from XXX to YYY, and for regions and countries from ZZZ to QQQ."
early-years-Mathematics,early-years-mathematics,Maths skills by end of early years foundation stage,,%,,1,pp,Percentage of 5 year olds at 'expected level' across all maths early learning goals,F,F,F,30/11/2023,https://explore-education-statistics.service.gov.uk/find-statistics/early-years-foundation-stage-profile-results,Department for Education,"This dataset shows the early years foundation stage profile outcomes of five year olds. Percentage at 'expected level' across all mathematics early learning goals, in England (state-funded schools), for academic years 2021/22 to 2022/23.","Data for this indicator is available for local authorities from XXX to YYY, and for regions and countries from ZZZ to QQQ."
child-obesity-Aged four to five years underweight,underweight-children-reception,Underweight prevalence in children at reception age,,%,,1,pp,Percentage of children aged 4-5 classified as underweight,F,F,F,07/11/2023,https://fingertips.phe.org.uk/profile/national-child-measurement-programme/data,Office for Health Improvement and Disparities,"This dataset shows the proportion of children aged 4-5 years (reception age) classified as underweight, in England, for academic years 2006/07 to 2022/23.","Data for this indicator is available for local authorities from XXX to YYY, and for regions and countries from ZZZ to QQQ."
child-obesity-Aged four to five years healthy weight,healthy-weight-children-reception,Healthy weight prevalence in children at reception age,,%,,1,pp,Percentage of children aged 4-5 classified as at a healthy weight,F,F,F,07/11/2023,https://fingertips.phe.org.uk/profile/national-child-measurement-programme/data,Office for Health Improvement and Disparities,"This dataset shows the proportion of children aged 4-5 years (reception age) classified as healthy weight, in England, for academic years 2006/07 to 2022/23.","Data for this indicator is available for local authorities from XXX to YYY, and for regions and countries from ZZZ to QQQ."
child-obesity-Aged four to five years overweight,overweight-children-reception,Overweight prevalence in children at reception age,,%,,1,pp,Percentage of children aged 4-5 classified as overweight,F,F,F,07/11/2023,https://fingertips.phe.org.uk/profile/national-child-measurement-programme/data,Office for Health Improvement and Disparities,"This dataset shows the proportion of children aged 4-5 years (reception age) classified as overweight, in England, for academic years 2006/07 to 2022/23.","Data for this indicator is available for local authorities from XXX to YYY, and for regions and countries from ZZZ to QQQ."
child-obesity-Aged four to five years obese,obese-children-reception,Obesity prevalence in children at reception age,,%,,1,pp,Percentage of children aged 4-5 classified as living with obesity,F,F,F,07/11/2023,https://fingertips.phe.org.uk/profile/national-child-measurement-programme/data,Office for Health Improvement and Disparities,"This dataset shows the proportion of children aged 4-5 years (reception age) classified as obese (including severe obesity), in England, for academic years 2006/07 to 2022/23.","Data for this indicator is available for local authorities from XXX to YYY, and for regions and countries from ZZZ to QQQ."
child-obesity-Aged 10 to 11 years underweight,underweight-children-year-6,Underweight prevalence in children at Year 6 age,,%,,1,pp,Percentage of children aged 10-11 classified as underweight,F,F,F,07/11/2023,https://fingertips.phe.org.uk/profile/national-child-measurement-programme/data,Office for Health Improvement and Disparities,"This dataset shows the proportion of children aged 10-11 years (Year 6 age) classified as underweight, in England, for academic years 2006/07 to 2022/23.","Data for this indicator is available for local authorities from XXX to YYY, and for regions and countries from ZZZ to QQQ."
child-obesity-Aged 10 to 11 years healthy weight,healthy-weight-children-year-6,Healthy weight prevalence in children at Year 6 age,,%,,1,pp,Percentage of children aged 10-11 classified as at a healthy weight,F,F,F,07/11/2023,https://fingertips.phe.org.uk/profile/national-child-measurement-programme/data,Office for Health Improvement and Disparities,"This dataset shows the proportion of children aged 10-11 years (Year 6 age) classified as healthy weight, in England, for academic years 2006/07 to 2022/23.","Data for this indicator is available for local authorities from XXX to YYY, and for regions and countries from ZZZ to QQQ."
child-obesity-Aged 10 to 11 years overweight,overweight-children-year-6,Overweight prevalence in children at Year 6 age,,%,,1,pp,Percentage of children aged 10-11 classified as overweight,F,F,F,07/11/2023,https://fingertips.phe.org.uk/profile/national-child-measurement-programme/data,Office for Health Improvement and Disparities,"This dataset shows the proportion of children aged 10-11 years (Year 6 age) classified as overweight, in England, for academic years 2006/07 to 2022/23.","Data for this indicator is available for local authorities from XXX to YYY, and for regions and countries from ZZZ to QQQ."
child-obesity-Aged 10 to 11 years obese,obese-children-year-6,Obesity prevalence in children at Year 6 age,,%,,1,pp,Percentage of children aged 10-11 classified as living with obesity,F,F,F,07/11/2023,https://fingertips.phe.org.uk/profile/national-child-measurement-programme/data,Office for Health Improvement and Disparities,"This dataset shows the proportion of children aged 10-11 years (Year 6 age) classified as obese (including severe obesity), in England, for academic years 2006/07 to 2022/23.","Data for this indicator is available for local authorities from XXX to YYY, and for regions and countries from ZZZ to QQQ."
cardiovascular-mortality-persons-aged-under-75-ni,ni-cardiovascular-mortality-considered-preventable,Preventable circulatory mortality (Northern Ireland),,,"per 100,000 population",1,abs,Age-standardised mortality from circulatory diseases considered preventable for people aged under 75,F,F,F,05/02/2024,https://www.health-ni.gov.uk/publications/age-standardised-death-rate-preventable-cardiovascular-disease-by-local-government-2001-2022,Northern Ireland Department of Health,"This dataset shows the age-standardised mortality rate from circulatory diseases considered preventable for those aged under 75 per 100,000 population (2019 definition), in Northern Ireland, for 2001 to 2022.","Data for this indicator is available for local authorities from XXX to YYY, and for regions and countries from ZZZ to QQQ."
business-demography-Births of new enterprises,births-of-new-enterprises,Business births,,,number of enterprises,0,abs,Count of newly active businesses based on turnover or employment,F,F,F,22/11/2023,https://www.ons.gov.uk/businessindustryandtrade/business/activitysizeandlocation/bulletins/businessdemography/previousReleases,Office for National Statistics,"This dataset shows the count of business births, in the UK, for 2017 to 2022.","Data for this indicator is available for local authorities from XXX to YYY, and for regions and countries from ZZZ to QQQ."
business-demography-Deaths of enterprises,deaths-of-enterprises,Business deaths,,,number of enterprises,0,abs,Count of businesses ceasing activity based on turnover or employment,F,F,F,22/11/2023,https://www.ons.gov.uk/businessindustryandtrade/business/activitysizeandlocation/bulletins/businessdemography/previousReleases,Office for National Statistics,"This dataset shows the count of business deaths, in the UK, for 2017 to 2022.","Data for this indicator is available for local authorities from XXX to YYY, and for regions and countries from ZZZ to QQQ."
business-demography-Active enterprises,active-enterprises,Active businesses,,,number of enterprises,0,abs,Businesses with turnover or employment in current year,F,F,F,22/11/2023,https://www.ons.gov.uk/businessindustryandtrade/business/activitysizeandlocation/bulletins/businessdemography/previousReleases,Office for National Statistics,"This dataset shows the count of acrive businesses, in the UK, for 2017 to 2022.","Data for this indicator is available for local authorities from XXX to YYY, and for regions and countries from ZZZ to QQQ."
business-demography-High growth enterprises,high-growth-enterprises,High growth businesses,,,number of enterprises,0,abs,Businesses with an average growth in employment of greater than 20% per year over a three-year period,F,F,F,22/11/2023,https://www.ons.gov.uk/businessindustryandtrade/business/activitysizeandlocation/bulletins/businessdemography/previousReleases,Office for National Statistics,"This dataset shows the count of high growth businesses, in the UK, for 2017 to 2022.","Data for this indicator is available for local authorities from XXX to YYY, and for regions and countries from ZZZ to QQQ."
apprenticeship-Apprenticeships starts,apprenticeships-starts-new,Apprenticeship starts,,,"per 100,000 population",0,abs,"Apprenticeship programme starts by people aged 16 or above, per 100,000 people",F,F,F,30/11/2023,https://explore-education-statistics.service.gov.uk/find-statistics/further-education-and-skills,Department for Education,"This dataset shows apprenticeships started by adults aged 16+ based on home address, rate per 100,000 population, in England, for full academic years 2017/18 to 2022/23.","Data for this indicator is available for local authorities from XXX to YYY, and for regions and countries from ZZZ to QQQ."
apprenticeship-Apprenticeships achievements,apprenticeships-achievements-new,Apprenticeship achievements,,,"per 100,000 population",0,abs,"Apprenticeship programme achievements by people aged 16 or above, per 100,000 people",F,F,F,30/11/2023,https://explore-education-statistics.service.gov.uk/find-statistics/further-education-and-skills,Department for Education,"This dataset shows apprenticeships achieved by adults aged 16+ based on home address, rate per 100,000 population, in England, for full academic years 2017/18 to 2022/23.","Data for this indicator is available for local authorities from XXX to YYY, and for regions and countries from ZZZ to QQQ."
aged-16-years-and-over-modelled-unemployment,modelled-unemployment,Modelled unemployment rate,,%,,1,pp,Modelled percentage of economically active people aged 16 years and over without a job and actively seeking work,F,F,F,16/01/2024,https://www.ons.gov.uk/employmentandlabourmarket/peopleinwork/employmentandemployeetypes/datasets/li01regionallabourmarketlocalindicatorsforcountieslocalandunitaryauthorities,Office for National Statistics,"This dataset shows modelled-based estimates for the proportion of economically active people aged 16 years and over without a job who have been actively seeking work within the last four weeks and are available to start work within the next two weeks, in Great Britain, for periods 10/2004-09/2005 to 10/2022-09/2023.","Data for this indicator is available for local authorities from XXX to YYY, and for regions and countries from ZZZ to QQQ."
aged-16-to-64-years-level3-or-above-qualifications-ni,ni-level-3-or-above-qualifications,Level 3 or above qualifications (Northern Ireland),,%,,1,pp,Percentage of people aged 16 to 64 with Level 3 or above qualifications,F,F,F,05/12/2023,https://www.nisra.gov.uk/publications/highest-qualification-level-2022,Northern Ireland Statistics and Research Agency,"This dataset shows the percentage of the population aged 16 to 64 with National Vocational Qualification (NVQ) level 3+ qualifications, in Northern Ireland, for 2016 to 2022.","Data for this indicator is available for local authorities from XXX to YYY, and for regions and countries from ZZZ to QQQ."
adult-obesity-prevalence-aged-18-years-and-over,overweight-adults,Adult obesity prevalence,,%,,1,pp,Percentage of adults aged 18 and over classified as living with obesity,F,F,F,03/05/2023,https://fingertips.phe.org.uk/profile/national-child-measurement-programme/data#page/1/gid/1938133368/pat/159/par/K02000001/ati/15/are/E92000001/yrr/1/cid/4/tbm/1,Office for Health Improvement and Disparities,"This dataset shows the percentage of adults aged 18 and over classified as living with obesity, in England, for 16/11/2015-15/11/2016 to 16/11/2021-15/11/2022.","Data for this indicator is available for local authorities from XXX to YYY, and for regions and countries from ZZZ to QQQ."
population-under-devolution-deal-in-england,population-under-devolution-deal,Population under devolution deal in England,,%,,1,pp,Percentage of the population living in an area covered by the highest level of devolution in England,F,F,F,13/01/2023,https://www.ons.gov.uk/peoplepopulationandcommunity/wellbeing/adhocs/15439populationlivinginanareacoveredbyacombinedauthorityorregionalgovernancebodythathasadevolutiondealwithadirectlyelectedmayorenglandasof13january2023,Office for National Statistics,"This dataset shows the percentage of the population living in an area covered by the highest level of devolution, in England, as of 13 January 2023.","Data for this indicator is available for local authorities from XXX to YYY, and for regions and countries from ZZZ to QQQ."