code,slug,label,prefix,suffix,subText,decimalPlaces,howToMeasureChange,subtitle,zeroBaseline,canBeNegative,experimentalStatistic,sourceDate,sourceURL,sourceOrg,longDescription,coverageLevel
4g-coverage,4g-coverage,4G coverage,,%,,1,pp,Percentage of area with 4G coverage from at least one mobile network provider,F,F,F,19/12/2023,https://www.ofcom.org.uk/research-and-data/multi-sector-research/infrastructure-research/connected-nations-2023/data-downloads,Ofcom,"This dataset shows the percentage of geographic areas with 4G signal outdoors from at least 1 operator (signal threshold: 105dBm), in the UK, as of September 2023.","Data for this indicator is available for local authorities from XXX to YYY, and for regions and countries from ZZZ to QQQ."
additions-to-the-housing-stock,additions-to-the-housing-stock,Net additions to the housing stock,,,"per 1,000 stock",0,abs,"Net additions to the stock of dwellings per 1,000 dwellings",F,T,F,20/11/2023,https://www.gov.uk/government/statistical-data-sets/live-tables-on-dwelling-stock-including-vacants#full-publication-update-history,"Department for Levelling Up, Housing and Communities","This dataset shows the net additions to the dwelling stock (including new builds, conversions, changes of use, other gains/losses and offset by demolitions) per 1,000 stock, in England, for financial year 2022 - 2023.","Data for this indicator is available for local authorities from XXX to YYY, and for regions and countries from ZZZ to QQQ."
aged-16-to-64-years-level-3-or-above-qualifications,level-3-or-above-qualifications,Level 3 or above qualifications,,%,,1,pp,Percentage of people aged 16 to 64 with Level 3 or above qualifications,F,F,F,12/04/2022,https://www.nomisweb.co.uk/datasets/apsnew,Office for National Statistics,"This dataset shows the percentage of the population aged 16 – 64 with National Vocational Qualification (NVQ) level 3+ qualifications, in Great Britain (Northern Ireland national figure included), for 2004 - 2021.","Data for this indicator is available for local authorities from XXX to YYY, and for regions and countries from ZZZ to QQQ."
aged-19-years-and-over-further-education-and-skills-learner-achievements,further-education-and-skills-learner-achievements,Further education and skills learner achievements,,,,0,abs,Count of learners aged 19 years and over achieving a funded further education and skills learning aim (with the exception of community learning),F,F,F,24/11/2022,https://explore-education-statistics.service.gov.uk/find-statistics/further-education-and-skills/2021-22,Department for Education,"This dataset shows the count of learners achieving a funded further education and skills learning aim, with the exception of community learning, non-qualification parts of the Multiply programme and bootcamps, in England, for academic years 2016/17 to 2021/22.","Data for this indicator is available for local authorities from XXX to YYY, and for regions and countries from ZZZ to QQQ."
aged-19-years-and-over-further-education-and-skills-participation,further-education-and-skills-participation,Further education and skills participation,,,"per 100,000 population",0,abs,"People aged 19 and above participating in further education and skills learning (including apprenticeships), per 100,000 people",F,F,F,30/11/2023,https://explore-education-statistics.service.gov.uk/data-catalogue/further-education-and-skills/2022-23,Department for Education,"This dataset shows 19+ further education and skills participation rate per 100,000 population, in England, for full academic years 2017/18 to 2022/23.","Data for this indicator is available for local authorities from XXX to YYY, and for regions and countries from ZZZ to QQQ."
annual-personal-wellbeing-estimates-Anxiety mean score (where 10 is 'completely anxious'),wellbeing-anxiety,Anxiety,,,score out of 10,1,abs,"Average rating for anxiety during previous day (0 = 'not at all anxious', 10 = 'completely anxious') for people aged 16 and over",F,F,F,07/11/2023,https://www.ons.gov.uk/peoplepopulationandcommunity/wellbeing/bulletins/measuringnationalwellbeing/previousReleases,Office for National Statistics,"This dataset shows the average rating of those that felt anxious yesterday (where 0 is 'not at all anxious' and 10 is 'completely anxious'), for adults aged 16 years and over, in the UK, for periods 04/2011-03/2012 to 04/2022-03/2023.","Data for this indicator is available for local authorities from XXX to YYY, and for regions and countries from ZZZ to QQQ."
annual-personal-wellbeing-estimates-Worthwhile mean score (where 10 is 'completely worthwhile'),wellbeing-worthwhile,Feeling life is worthwhile,,,score out of 10,1,abs,"Average rating that the things they do in life are worthwhile (0 = 'not at all worthwhile', 10 = 'completely worthwhile') for people aged 16 and over",F,F,F,07/11/2023,https://www.ons.gov.uk/peoplepopulationandcommunity/wellbeing/bulletins/measuringnationalwellbeing/previousReleases,Office for National Statistics,"This dataset shows the average rating of those that feel the things they do in life are worthwhile (where 0 is 'not at all worthwhile' and 10 is 'completely worthwhile'), for adults aged 16 years and over, in the UK, for periods 04/2011-03/2012 to 04/2022-03/2023.","Data for this indicator is available for local authorities from XXX to YYY, and for regions and countries from ZZZ to QQQ."
annual-personal-wellbeing-estimates-Happiness mean score (where 10 is 'completely happy'),wellbeing-happiness,Happiness,,,score out of 10,1,abs,"Average rating for happiness during previous day (0 = 'not at all happy', 10 = 'completely happy') for people aged 16 and over",F,F,F,07/11/2023,https://www.ons.gov.uk/peoplepopulationandcommunity/wellbeing/bulletins/measuringnationalwellbeing/previousReleases,Office for National Statistics,"This dataset shows the average rating of those that felt happy yesterday (where 0 is 'not at all happy' and 10 is 'completely happy'), for adults aged 16 years and over, in the UK, for periods 04/2011-03/2012 to 04/2022-03/2023.","Data for this indicator is available for local authorities from XXX to YYY, and for regions and countries from ZZZ to QQQ."
annual-personal-wellbeing-estimates-Satisfaction mean score (where 10 is 'completely satisfied'),wellbeing-satisfaction,Life satisfaction,,,score out of 10,1,abs,"Average rating of life satisfaction (0 = 'not at all satisfied', 10 = 'completely satisfied') for people aged 16 and over",F,F,F,07/11/2023,https://www.ons.gov.uk/peoplepopulationandcommunity/wellbeing/bulletins/measuringnationalwellbeing/previousReleases,Office for National Statistics,"This dataset shows the average rating of those that feel satisfied about their lives (where 0 is 'not at all satisfied' and 10 is 'completely satisfied'), for adults aged 16 years and over, in the UK, for periods 04/2011-03/2012 to 04/2022-03/2023.","Data for this indicator is available for local authorities from XXX to YYY, and for regions and countries from ZZZ to QQQ."
average-travel-time-long-cycling,average-travel-time-long-cycling,Travel time to employment centre by bicycle,,,minutes,1,abs,Average travel time in minutes to nearest employment centre with 500+ jobs available,F,F,T,04/11/2021,https://www.gov.uk/government/statistical-data-sets/journey-time-statistics-data-tables-jts,Department for Transport,"This dataset shows the average travel time in minutes to nearest employment centre with 500 to 4999 jobs available by cycle (official statistics in development), in England, for periods 2014-2019.","Data for this indicator is available for local authorities from XXX to YYY, and for regions and countries from ZZZ to QQQ."
average-travel-time-long-driving,average-travel-time-long-driving,Travel time to employment centre by car,,,minutes,1,abs,Average travel time in minutes to nearest employment centre with 500+ jobs available,F,F,T,04/11/2021,https://www.gov.uk/government/statistical-data-sets/journey-time-statistics-data-tables-jts,Department for Transport,"This dataset shows the average travel time in minutes to nearest employment centre with 500 to 4999 jobs available by car (official statistics in development), in England, for periods 2014-2019.","Data for this indicator is available for local authorities from XXX to YYY, and for regions and countries from ZZZ to QQQ."
average-travel-time-long-public transport or walking,average-travel-time-long-public-transport-or-walking,Travel time to employment centre by public transport and walking,,,minutes,1,abs,Average travel time in minutes to nearest employment centre with 500+ jobs available,F,F,T,04/11/2021,https://www.gov.uk/government/statistical-data-sets/journey-time-statistics-data-tables-jts,Department for Transport,"This dataset shows the average travel time in minutes to nearest employment centre with 500 to 4999 jobs available by public transport or walking (official statistics in development), in England, for periods 2014-2019.","Data for this indicator is available for local authorities from XXX to YYY, and for regions and countries from ZZZ to QQQ."
cancer-diagnosis-at-stage-1-and-2,cancer-diagnosis-at-stage-1-and-2,Cancer diagnosis at stage 1 and 2,,%,,1,pp,New cases of cancer diagnosed at stages 1 and 2 as a percentage of all new cases of cancer diagnosed at any known stage,F,F,F,06/02/2024,https://fingertips.phe.org.uk/profile/public-health-outcomes-framework/data#page/4/gid/1000042/pat/15/par/E92000001/ati/6/are/E12000004/iid/93671/age/1/sex/4/cat/-1/ctp/-1/yrr/1/cid/4/tbm/1/page-options/car-ao-0_car-do-0_tre-ao-1,Office for Health Improvement and Disparities,"This dataset shows new cases of cancer diagnosed at stages 1 and 2 as a percentage of all new cases of cancer diagnosed at any known stage, in England, for 2013 to 2021.","Data for this indicator is available for local authorities from XXX to YYY, and for regions and countries from ZZZ to QQQ."
cardiovascular-mortality-considered-preventable-in-persons-aged-under-75-2021-census-population-estimates,cardiovascular-mortality-considered-preventable,Preventable circulatory mortality (England),,,"per 100,000 population",1,abs,Age-standardised mortality from circulatory diseases considered preventable for people aged under 75,F,F,F,06/02/2024,https://fingertips.phe.org.uk/profile/public-health-outcomes-framework/data#page/4/gid/1000044/pat/159/par/K02000001/ati/15/are/E92000001/iid/93722/age/163/sex/4/cat/-1/ctp/-1/yrr/3/cid/4/tbm/1/page-options/car-do-0,Office for Health Improvement and Disparities,"This dataset shows the age-standardised mortality rate from circulatory diseases considered preventable for those aged under 75 per 100,000 population (2019 definition), in England, for three-year rolling periods 2001-2003 to 2020-2022.","Data for this indicator is available for local authorities from XXX to YYY, and for regions and countries from ZZZ to QQQ."
cigarette-smokers,cigarette-smokers,Cigarette smokers,,%,,1,pp,Percentage of people aged 18 and over who state they currently smoke cigarettes (excluding e-cigarettes),F,F,F,05/09/2023,https://www.ons.gov.uk/peoplepopulationandcommunity/healthandsocialcare/healthandlifeexpectancies/datasets/smokinghabitsintheukanditsconstituentcountries,Office for National Statistics,"This dataset shows the percentage of adults (18+) who state they currently smoke cigarettes (excluding e-cigarettes), in the United Kingdom, for 2012 - 2022.","Data for this indicator is available for local authorities from XXX to YYY, and for regions and countries from ZZZ to QQQ."
employment-rate-long-Employment Rate,employment-rate,Employment rate (Great Britain),,%,,1,pp,Percentage of people aged 16 to 64 in employment,F,F,F,16/01/2024,https://www.ons.gov.uk/employmentandlabourmarket/peopleinwork/employmentandemployeetypes/datasets/li01regionallabourmarketlocalindicatorsforcountieslocalandunitaryauthorities,Office for National Statistics,"This dataset shows the proportion of people aged between 16 and 64 years in paid work or who had a job that they were temporarily away from, in Great Britain (Northern Ireland national figure included), for periods 10/2004-09/2005 to 10/2022-09/2023.","Data for this indicator is available for local authorities from XXX to YYY, and for regions and countries from ZZZ to QQQ."
employment-rate-long-Economic Inactivity Rate,economic-inactivity-rate,Economic inactivity rate (Great Britain),,%,,1,pp,Percentage of people aged 16 to 64 who are not in employment and are not actively seeking work,F,F,F,16/01/2024,https://www.ons.gov.uk/employmentandlabourmarket/peopleinwork/employmentandemployeetypes/datasets/li01regionallabourmarketlocalindicatorsforcountieslocalandunitaryauthorities,Office for National Statistics,"This dataset shows the proportion of people aged between 16 and 64 years who are not in employment but do not meet the internationally accepted definition of unemployment because they have not been seeking work within the last four weeks or they are unable to start work in the next two weeks, in Great Britain (Northern Ireland national figure included), for periods 10/2004-09/2005 to 10/2022-09/2023.","Data for this indicator is available for local authorities from XXX to YYY, and for regions and countries from ZZZ to QQQ."
healthy-life-expectancy-Female healthy life expectancy,female-healthy-life-expectancy,Female healthly life expectancy,,,years,1,abs,Average years expected to be lived in good health for females born during year,F,F,F,04/03/2022,https://www.ons.gov.uk/peoplepopulationandcommunity/healthandsocialcare/healthandlifeexpectancies/bulletins/healthstatelifeexpectanciesuk/previousReleases#,Office for National Statistics,"This dataset shows the average years expected to be lived in good health for females born during the reference period, in the United Kingdom, for calendar years 2011 - 2013 to 2018 - 2020.","Data for this indicator is available for local authorities from XXX to YYY, and for regions and countries from ZZZ to QQQ."
gcses-and-equivalent-in-english-and-maths-by-age-19,gcses-and-equivalent-in-english-and-maths,GCSEs in English and Maths,,%,,1,pp,Percentage of people achieving GCSEs in both subjects by age 19,F,F,F,27/04/2023,https://explore-education-statistics.service.gov.uk/find-statistics/level-2-and-3-attainment-by-young-people-aged-19,Department for Education,"This dataset shows GCSEs (and equivalent) in English and maths by age 19, in England, for academic years 2016/17 to 2021/22.","Data for this indicator is available for local authorities from XXX to YYY, and for regions and countries from ZZZ to QQQ."
gigabit-capable-broadband,gigabit-capable-broadband,Gigabit capable broadband,,%,,1,pp,Percentage of premises with 125 megabytes or greater of broadband speed,F,F,F,19/12/2023,https://www.ofcom.org.uk/research-and-data/multi-sector-research/infrastructure-research/connected-nations-2023/data-downloads,Ofcom,"This dataset shows the percentage of premises with 125 megabytes (MB) or greater, in the UK, as of September 2023.","Data for this indicator is available for local authorities from XXX to YYY, and for regions and countries from ZZZ to QQQ."
gross-disposable-household-income-per-head,gross-disposable-household-income-per-head,Gross disposable household income,GBPSign,,,0,abs,Average income per person after taxes and direct benefits,F,F,F,14/09/2023,https://www.ons.gov.uk/economy/regionalaccounts/grossdisposablehouseholdincome/bulletins/regionalgrossdisposablehouseholdincomegdhi/previousReleases#,Office for National Statistics,"This dataset shows an estimate of the amount of money each individual within a household has available for spending or saving after they have paid taxes and received any direct benefits, in the UK, for 1997-2021.","Data for this indicator is available for local authorities from XXX to YYY, and for regions and countries from ZZZ to QQQ."
gross-median-weekly-pay,gross-median-weekly-pay,Gross median weekly pay,GBPSign,,,1,abs,Average weekly pay based on where people live,F,F,F,2023-11-01|2023-11-01,https://www.ons.gov.uk/employmentandlabourmarket/peopleinwork/earningsandworkinghours/bulletins/annualsurveyofhoursandearnings/previousReleases|https://www.nisra.gov.uk/statistics/labour-market-and-social-welfare/annual-survey-hours-and-earnings,Office for National Statistics|Northern Ireland Statistics and Research Agency,"This dataset shows the average (median) weekly pay based on where people live, in the UK, for 2002-2023.","Data for this indicator is available for local authorities from XXX to YYY, and for regions and countries from ZZZ to QQQ."
gross-value-added-per-hour-worked,gross-value-added-per-hour-worked,Gross value added per hour worked,GBPSign,,,1,abs,Estimated value of goods and services produced per hour worked ,F,F,T,20/06/2023,https://www.ons.gov.uk/employmentandlabourmarket/peopleinwork/labourproductivity/articles/regionalandsubregionalproductivityintheuk/previousReleases,Office for National Statistics|Northern Ireland Statistics and Research Agency,"This dataset shows the measure of business productivity (estimate of the volume of goods and services produced) in £ per hour worked (official statistics in development), in the UK, for 2004-2021.","Data for this indicator is available for local authorities from XXX to YYY, and for regions and countries from ZZZ to QQQ."
homicide-offences,homicide-offences,Homicide offences,,,per million population,1,abs,Homicide offences per million people,F,F,F,08/02/2024,https://www.ons.gov.uk/peoplepopulationandcommunity/crimeandjustice/articles/homicideinenglandandwales/previousReleases#,Office for National Statistics|Northern Ireland Statistics and Research Agency,"This dataset shows the rate of Homicide offences per million population, in England and Wales, for period 04/2020-03/2023.","Data for this indicator is available for local authorities from XXX to YYY, and for regions and countries from ZZZ to QQQ."
healthy-life-expectancy-Male healthy life expectancy,male-healthy-life-expectancy,Male healthy life expectancy,,,years,1,abs,Average years expected to be lived in good health for males born during year,F,F,F,04/03/2022,https://www.ons.gov.uk/peoplepopulationandcommunity/healthandsocialcare/healthandlifeexpectancies/bulletins/healthstatelifeexpectanciesuk/previousReleases#,Office for National Statistics,"This dataset shows the average years expected to be lived in good health for males born during the reference period, in the United Kingdom, for calendar years 2011 - 2013 to 2018 - 2020.","Data for this indicator is available for local authorities from XXX to YYY, and for regions and countries from ZZZ to QQQ."
persistent-absences-for-all-pupils,persistent-absences-for-all-pupils,Persistent absences for all pupils,,%,,1,pp,Percentage of pupils in state-funded schools that were absent for 10% of academic year,F,F,F,16/03/2023,https://explore-education-statistics.service.gov.uk/find-statistics/pupil-absence-in-schools-in-england#,Department for Education,"This dataset shows the percentage of pupils in state-funded primary, state funded secondary and special schools that were persistently absent (those absent for 10% of schooling sessions) during the academic year, in England (state-funded schools), for academic years 2008/09 - 2021/22.","Data for this indicator is available for local authorities from XXX to YYY, and for regions and countries from ZZZ to QQQ."
persistent-absences-for-pupils-eligible-for-free-school-meals,persistent-absences-for-pupils-eligible-for-free-school-meals,Persistent absences for pupils eligible for free school meals,,%,,1,pp,Percentage of FSM-eligible pupils in state-funded schools that were absent for 10% of academic year,F,F,F,16/03/2023,https://explore-education-statistics.service.gov.uk/find-statistics/pupil-absence-in-schools-in-england,Department for Education,"This dataset shows the percentage of pupils in state-funded primary, state funded secondary and special schools who have been eligible for free school meals in the past 6 years that were persistently absent (those absent for 10% of schooling sessions) during the academic year, in England (state-funded schools), for academic years 2017/18 - 2021/22.","Data for this indicator is available for local authorities from XXX to YYY, and for regions and countries from ZZZ to QQQ."
persistent-absences-for-pupils-looked-after-by-local-authorities,persistent-absences-for-pupils-looked-after-by-local-authorities,Persistent absences for pupils looked after by local authorities,,%,,1,pp,Percentage of pupils looked after continuously by local authorities for at least 12 months that were absent for 10% of academic year,F,F,F,30/03/2023,https://explore-education-statistics.service.gov.uk/find-statistics/outcomes-for-children-in-need-including-children-looked-after-by-local-authorities-in-england,Department for Education,"This dataset shows the percentage of pupils in state-funded primary, state funded secondary, special schools and pupil referral units who have been looked after continuously for at least 12 months (as of 31 March of that year) by local authorities who were persistently absent (those absent for 10% of schooling sessions) during the academic year, in England (state-funded primary and secondary schools, special schools and pupil referral units), for financial years 2016/17 - 2021/22.","Data for this indicator is available for local authorities from XXX to YYY, and for regions and countries from ZZZ to QQQ."
pupils-at-expected-standards-by-end-of-primary-school,pupils-at-expected-standards-by-end-of-primary-school,Pupils at expected standards at the end of key stage 2,,%,,0,pp,"Percentage of pupils in state-funded schools meeting the expected standard in reading, writing and maths",F,F,F,14/12/2023,https://explore-education-statistics.service.gov.uk/find-statistics/key-stage-2-attainment,Department for Education,"This dataset shows the percentage of pupils in state-funded schools meeting the expected standard in reading, writing and maths at the end of key stage 2, in England state-funded schools, for academic years 2015/16 - 2022/23.","Data for this indicator is available for local authorities from XXX to YYY, and for regions and countries from ZZZ to QQQ."
schools-and-nursery-schools-rated-good-or-outstanding,schools-and-nursery-schools-rated-good-or-outstanding,Schools and nurseries rated good or outstanding,,%,,1,pp,Percentage of state-funded schools rated good or outstanding by Ofsted,F,F,F,13/02/2024,https://www.gov.uk/government/statistical-data-sets/monthly-management-information-ofsteds-school-inspections-outcomes,Ofsted,"This dataset shows the percentage of state-funded Nursery schools, Primary schools, Secondary schools, Alternative Provision (AP) schools and Special schools that are rated ‘Good’ or ‘Outstanding’ by Ofsted, in England (state-funded schools), as at 31 January 2024.","Data for this indicator is available for local authorities from XXX to YYY, and for regions and countries from ZZZ to QQQ."
total-value-of-uk-exports,value-of-uk-exports,Value of UK exports,GBPSign,,million,0,abs,Estimated total value of UK exports including trade in both goods and services,F,F,T,28/06/2023,https://www.ons.gov.uk/businessindustryandtrade/internationaltrade/bulletins/internationaltradeinuknationsregionsandcities/previousReleases,Office for National Statistics,"This dataset shows the estimated total value of UK exports including trade in both goods and services (official statistics in development), in the UK, for 2021.","Data for this indicator is available for local authorities from XXX to YYY, and for regions and countries from ZZZ to QQQ."
ni-employment-rate-Economic Inactivity Rate,ni-economic-inactivity-rate,Economic inactivity rate (Northern Ireland),,%,,1,pp,Percentage of people aged 16 to 64 who are not in employment and are not actively seeking work,F,F,F,24/10/2023,https://www.nisra.gov.uk/statistics/labour-market-and-social-welfare/labour-force-survey,Northern Ireland Statistics and Research Agency,"This dataset shows the proportion of people aged between 16 and 64 years who are not in employment but do not meet the internationally accepted definition of unemployment because they have not been seeking work within the last four weeks or they are unable to start work in the next two weeks, in Northern Ireland, for 2022.","Data for this indicator is available for local authorities from XXX to YYY, and for regions and countries from ZZZ to QQQ."
ni-employment-rate-Employment Rate,ni-employment-rate,Employment rate (Northern Ireland),,%,,1,pp,Percentage of people aged 16 to 64 in employment,F,F,F,24/10/2023,https://www.nisra.gov.uk/statistics/labour-market-and-social-welfare/labour-force-survey,Northern Ireland Statistics and Research Agency,"This dataset shows the proportion of people aged between 16 and 64 years in paid work or who had a job that they were temporarily away from, in Northern Ireland, for 2022.","Data for this indicator is available for local authorities from XXX to YYY, and for regions and countries from ZZZ to QQQ."
